{
  "SPDX-License-Identifier": "MIT",
  "$schema": "https://json-schema.org/draft/2020-12/schema",
  "title": "Gate D qualification bootstrap plan v1",
  "type": "object",
  "additionalProperties": false,
  "required": [
    "SPDX-License-Identifier",
    "schemaVersion",
    "kind",
    "operationId",
    "hostId",
    "predecessorVersion",
    "kernelRelease",
    "stagingDirectory",
    "candidate",
    "qualificationIdentity",
    "administrator",
    "argv",
    "cleanupArgv",
    "recoveryArgv",
    "journal",
    "deadlineSeconds",
    "expectedPreState",
    "expectedPostState",
    "retainedTools",
    "cleanupPaths",
    "safety"
  ],
  "properties": {
    "SPDX-License-Identifier": {
      "const": "MIT"
    },
    "schemaVersion": {
      "enum": [1, 2, 3, 4]
    },
    "kind": {
      "const": "gate-d-qualification-bootstrap-plan"
    },
    "operationId": {
      "type": "string"
    },
    "hostId": {
      "type": "string"
    },
    "qualificationRoot": {
      "$ref": "gate-d-qualification-root-v1.schema.json"
    },
    "predecessorVersion": {
      "type": "string"
    },
    "kernelRelease": {
      "type": "string"
    },
    "stagingDirectory": {
      "type": "string"
    },
    "candidate": {
      "type": "object"
    },
    "qualificationIdentity": {
      "type": "object"
    },
    "administrator": {
      "type": "object"
    },
    "argv": {
      "type": "array",
      "items": {
        "type": "string"
      }
    },
    "cleanupArgv": {
      "type": "array",
      "items": {"type": "string"}
    },
    "recoveryArgv": {
      "type": "array",
      "items": {
        "type": "string"
      }
    },
    "journal": {
      "type": "string"
    },
    "deadlineSeconds": {
      "type": "integer",
      "minimum": 1,
      "maximum": 1800
    },
    "expectedPreState": {
      "type": "object"
    },
    "expectedPostState": {
      "type": "object"
    },
    "retainedTools": {
      "type": "array",
      "minItems": 1
    },
    "packagePaths": {
      "type": "array",
      "minItems": 1,
      "items": {"$ref": "#/$defs/packagePath"}
    },
    "packagePathsSha256": {"type":"string","pattern":"^[0-9a-f]{64}$"},
    "cleanupPaths": {
      "type": "array",
      "minItems": 1
    },
    "safety": {
      "type": "object"
    }
  },
  "allOf": [
    {"if": {"properties": {"schemaVersion": {"enum": [2, 3, 4]}}, "required": ["schemaVersion"]}, "then": {"required": ["qualificationRoot"]}},
    {"if": {"properties": {"schemaVersion": {"const": 4}}, "required": ["schemaVersion"]}, "then": {"required": ["packagePaths","packagePathsSha256"]}},
    {"if": {"properties": {"schemaVersion": {"const": 1}}, "required": ["schemaVersion"]}, "then": {"not": {"required": ["qualificationRoot"]}}}
  ],
  "$defs": {
    "packagePath": {
      "oneOf": [
        {"type":"object","additionalProperties":false,"required":["path","type","sha256","mode","ownerUid","groupGid"],"properties":{"path":{"type":"string","pattern":"^/"},"type":{"const":"file"},"sha256":{"type":"string","pattern":"^[0-9a-f]{64}$"},"mode":{"enum":["0644","0755"]},"ownerUid":{"type":"integer","minimum":0},"groupGid":{"type":"integer","minimum":0}}},
        {"type":"object","additionalProperties":false,"required":["path","type","target","mode","ownerUid","groupGid"],"properties":{"path":{"type":"string","pattern":"^/"},"type":{"const":"symlink"},"target":{"type":"string","minLength":1,"pattern":"^[^/]"},"mode":{"enum":["0755","0777"]},"ownerUid":{"type":"integer","minimum":0},"groupGid":{"type":"integer","minimum":0}}}
      ]
    }
  }
}
