{
  "SPDX-License-Identifier": "MIT",
  "administrator": {
    "bootstrapPath": "/home/pi/gate-d-inputs/phase5.32-4e62b3a0b584/extracted/rp1-gpclk-dkms-0.0.0-phase5.32/scripts/rp1-gpclk-admin.py",
    "installedPath": "/usr/libexec/rp1-gpclk-dkms/rp1-gpclk-admin",
    "installedSha256": "08af368280582cec20f7c5c2093b5516a482aed3acc58bc9579ff64b2bd980ca",
    "sourcePath": "scripts/rp1-gpclk-admin.py",
    "sourceSha256": "08af368280582cec20f7c5c2093b5516a482aed3acc58bc9579ff64b2bd980ca"
  },
  "argv": [
    "/usr/bin/python3",
    "/home/pi/gate-d-inputs/phase5.32-4e62b3a0b584/extracted/rp1-gpclk-dkms-0.0.0-phase5.32/scripts/rp1-gpclk-admin.py",
    "install",
    "--execute",
    "--release-directory",
    "/home/pi/gate-d-inputs/phase5.32-4e62b3a0b584",
    "--route",
    "gpio4",
    "--qualification-install",
    "--qualification-identity",
    "/home/pi/gate-d-inputs/phase5.32-4e62b3a0b584/gate-d-phase5.32-qualification-install-identity.json"
  ],
  "candidate": {
    "archive": "/home/pi/gate-d-inputs/phase5.32-4e62b3a0b584/rp1-gpclk-dkms-0.0.0-phase5.32.tar.gz",
    "archiveSha256": "068a3c78011427f643c4880e9bb18d59c1d4bfdb812f82c76137ab64d2365bbe",
    "release": "0.0.0-phase5.32",
    "sourceCommit": "4e62b3a0b584396a9528be07592d92e0796555f2"
  },
  "cleanupArgv": [
    "/usr/libexec/rp1-gpclk-dkms/gate-d-lifecycle",
    "dispatch",
    "complete-removal",
    "0.0.0-phase5.2",
    "0.0.0-phase5.32",
    "6.18.34+rpt-rpi-2712",
    "/var/lib/rp1-gpclk-dkms/gate-d/bootstrap-phase5.32",
    "--execute"
  ],
  "cleanupPaths": [
    "/var/lib/rp1-gpclk-dkms/gate-d/bootstrap-phase5.32"
  ],
  "deadlineSeconds": 1800,
  "expectedPostState": {
    "dkmsTestVersions": false,
    "endpointPresent": false,
    "liveOutput": false,
    "moduleLoaded": false,
    "overlayActive": false
  },
  "expectedPreState": {
    "dkmsTestVersions": false,
    "endpointPresent": false,
    "liveOutput": false,
    "moduleLoaded": false,
    "overlayActive": false
  },
  "hostId": "wspr5-stock",
  "journal": "/var/lib/rp1-gpclk-dkms/gate-d/bootstrap-phase5.32.json",
  "kernelRelease": "6.18.34+rpt-rpi-2712",
  "kind": "gate-d-qualification-bootstrap-plan",
  "operationId": "phase5.32-qualification-bootstrap",
  "predecessorVersion": "0.0.0-phase5.2",
  "qualificationIdentity": {
    "path": "/home/pi/gate-d-inputs/phase5.32-4e62b3a0b584/gate-d-phase5.32-qualification-install-identity.json",
    "sha256": "e97d24d77e0747c76a96c552235ba283b5e267cceac56d78844907ab2605a107"
  },
  "qualificationRoot": {
    "identityFile": ".gate-d-root.json",
    "identitySha256": "3c7bb729151bd353808ae808725470352fc1d25d8068abba9405adee50d9334d",
    "mode": "0700",
    "ownerUid": 1000,
    "path": "/home/pi/gate-d-qualification/phase5.32-4e62b3a0b584"
  },
  "recoveryArgv": [
    "/usr/bin/python3",
    "/home/pi/gate-d-inputs/phase5.32-4e62b3a0b584/extracted/rp1-gpclk-dkms-0.0.0-phase5.32/scripts/rp1-gpclk-admin.py",
    "recover",
    "--execute"
  ],
  "retainedTools": [
    {
      "path": "/usr/libexec/rp1-gpclk-dkms/gate-d-boot",
      "sha256": "731b122fbc154e4945397bf844bdb093865175f16b92376972fd72e352893bf3"
    },
    {
      "path": "/usr/libexec/rp1-gpclk-dkms/gate-d-bootstrap",
      "sha256": "a656e17673f1799e7d43d9f9992ff975a745e796f80d9035de33e02328276dfe"
    },
    {
      "path": "/usr/libexec/rp1-gpclk-dkms/gate-d-busy-injector",
      "sha256": "c01d97301fcbad4266e6fd41c040f561da0c106affc28cf353455e4a071331dd"
    },
    {
      "path": "/usr/libexec/rp1-gpclk-dkms/gate-d-executor",
      "sha256": "d81824ab0454ecb298714e07c08ff9d81255d216152631e5285e51e08ac1d43f"
    },
    {
      "path": "/usr/libexec/rp1-gpclk-dkms/gate-d-instance",
      "sha256": "dcf3bc81646d71bc6ab431077fda06b3c61d7b06750d7354436aee24cad8b907"
    },
    {
      "path": "/usr/libexec/rp1-gpclk-dkms/gate-d-lifecycle",
      "sha256": "1e6fbf956bb610f9d9cf27f35af99f9bc6244a87aa0e91c9d918b8f9a84b4205"
    },
    {
      "path": "/usr/libexec/rp1-gpclk-dkms/gate-d-platform",
      "sha256": "d749859b0c915c4cfde8df85aa088359f7ed87d77183ae927c82bc1f149afb3c"
    },
    {
      "path": "/usr/libexec/rp1-gpclk-dkms/gate-d-target-plan",
      "sha256": "f8becd4ea0b33f3f7021e97e882630afcd6a343eb0be8cd8e57473a09099d756"
    },
    {
      "path": "/usr/libexec/rp1-gpclk-dkms/gate-d-uapi-probe",
      "sha256": "1ee335da403784a775efc049f49eb598e3541c625418b65015b322e29b0a1742"
    },
    {
      "path": "/usr/libexec/rp1-gpclk-dkms/gate_d_attempts.py",
      "sha256": "1abd78b87f81c65d63770979e8207bb6fb41d812d7681d7d822c40cde532d537"
    },
    {
      "path": "/usr/libexec/rp1-gpclk-dkms/gate_d_bootstrap.py",
      "sha256": "a656e17673f1799e7d43d9f9992ff975a745e796f80d9035de33e02328276dfe"
    },
    {
      "path": "/usr/libexec/rp1-gpclk-dkms/gate_d_instance.py",
      "sha256": "dcf3bc81646d71bc6ab431077fda06b3c61d7b06750d7354436aee24cad8b907"
    },
    {
      "path": "/usr/libexec/rp1-gpclk-dkms/gate_d_lifecycle.py",
      "sha256": "1e6fbf956bb610f9d9cf27f35af99f9bc6244a87aa0e91c9d918b8f9a84b4205"
    },
    {
      "path": "/usr/libexec/rp1-gpclk-dkms/gate_d_outer.py",
      "sha256": "d81824ab0454ecb298714e07c08ff9d81255d216152631e5285e51e08ac1d43f"
    },
    {
      "path": "/usr/libexec/rp1-gpclk-dkms/gate_d_preroot.py",
      "sha256": "9a2d5b309c1e06f40c062b520d229c9f55040125737738b9689c0d8594ae9272"
    },
    {
      "path": "/usr/libexec/rp1-gpclk-dkms/gate_d_root.py",
      "sha256": "d8227d99dda0fd8c3383e7b080b23d7407ff26520cc73a18ab3882d06ca4b94d"
    },
    {
      "path": "/usr/libexec/rp1-gpclk-dkms/gate_d_target_plan.py",
      "sha256": "f8becd4ea0b33f3f7021e97e882630afcd6a343eb0be8cd8e57473a09099d756"
    },
    {
      "path": "/usr/libexec/rp1-gpclk-dkms/rp1-gpclk-admin",
      "sha256": "08af368280582cec20f7c5c2093b5516a482aed3acc58bc9579ff64b2bd980ca"
    }
  ],
  "safety": {
    "clockEnabled": false,
    "dmaActive": false,
    "gpioAccess": false,
    "liveOutput": false,
    "outputDisabled": true,
    "rf": false,
    "sdrActive": false
  },
  "schemaVersion": 3,
  "stagingDirectory": "/var/lib/rp1-gpclk-dkms/gate-d/bootstrap-phase5.32"
}
