{
  "SPDX-License-Identifier": "MIT",
  "administrator": {
    "bootstrapPath": "/home/pi/gate-d-inputs/phase5.37-71932324ec97/extracted/rp1-gpclk-dkms-0.0.0-phase5.37/scripts/rp1-gpclk-admin.py",
    "installedPath": "/usr/libexec/rp1-gpclk-dkms/rp1-gpclk-admin",
    "installedSha256": "b99900c3c43c2eeeebdf89ec0f498014dcdc68769b2013749d4486890cfb831b",
    "sourcePath": "scripts/rp1-gpclk-admin.py",
    "sourceSha256": "b99900c3c43c2eeeebdf89ec0f498014dcdc68769b2013749d4486890cfb831b"
  },
  "argv": [
    "/usr/bin/python3",
    "/home/pi/gate-d-inputs/phase5.37-71932324ec97/extracted/rp1-gpclk-dkms-0.0.0-phase5.37/scripts/rp1-gpclk-admin.py",
    "install",
    "--execute",
    "--release-directory",
    "/home/pi/gate-d-inputs/phase5.37-71932324ec97",
    "--route",
    "gpio4",
    "--qualification-install",
    "--qualification-identity",
    "/home/pi/gate-d-inputs/phase5.37-71932324ec97/gate-d-phase5.37-qualification-install-identity.json"
  ],
  "candidate": {
    "archive": "/home/pi/gate-d-inputs/phase5.37-71932324ec97/rp1-gpclk-dkms-0.0.0-phase5.37.tar.gz",
    "archiveSha256": "299e8abe61f7c4ee81d9431539dcbae3614d33be2dafca0cb94a83996a4146ef",
    "release": "0.0.0-phase5.37",
    "sourceCommit": "71932324ec977d30ec0fadd48ef2673c49a6e173"
  },
  "cleanupArgv": [
    "/usr/libexec/rp1-gpclk-dkms/gate-d-lifecycle",
    "dispatch",
    "complete-removal",
    "0.0.0-phase5.2",
    "0.0.0-phase5.37",
    "6.18.34+rpt-rpi-2712",
    "/var/lib/rp1-gpclk-dkms/gate-d/bootstrap-phase5.37",
    "--execute"
  ],
  "cleanupPaths": [
    "/var/lib/rp1-gpclk-dkms/gate-d/bootstrap-phase5.37"
  ],
  "deadlineSeconds": 1800,
  "expectedPostState": {
    "dkmsTestVersions": false,
    "endpointPresent": false,
    "liveOutput": false,
    "moduleLoaded": false,
    "overlayActive": false
  },
  "expectedPreState": {
    "dkmsTestVersions": false,
    "endpointPresent": false,
    "liveOutput": false,
    "moduleLoaded": false,
    "overlayActive": false
  },
  "hostId": "wspr5-stock",
  "journal": "/var/lib/rp1-gpclk-dkms/gate-d/bootstrap-phase5.37.json",
  "kernelRelease": "6.18.34+rpt-rpi-2712",
  "kind": "gate-d-qualification-bootstrap-plan",
  "operationId": "phase5.37-qualification-bootstrap",
  "predecessorVersion": "0.0.0-phase5.2",
  "qualificationIdentity": {
    "path": "/home/pi/gate-d-inputs/phase5.37-71932324ec97/gate-d-phase5.37-qualification-install-identity.json",
    "sha256": "9d3618d8697069239f4203d301388da0e6829933f2ad3f713cea6109d2988e70"
  },
  "qualificationRoot": {
    "identityFile": ".gate-d-root.json",
    "identitySha256": "cdf40858837e08b0bace14093013371fb8390caa9e54ffdf79fa34dbfe81b824",
    "mode": "0700",
    "ownerUid": 1000,
    "path": "/home/pi/gate-d-qualification/phase5.37-71932324ec97"
  },
  "recoveryArgv": [
    "/usr/bin/python3",
    "/home/pi/gate-d-inputs/phase5.37-71932324ec97/extracted/rp1-gpclk-dkms-0.0.0-phase5.37/scripts/rp1-gpclk-admin.py",
    "recover",
    "--execute"
  ],
  "retainedTools": [
    {
      "path": "/usr/libexec/rp1-gpclk-dkms/gate-d-attempts",
      "sha256": "7496e08b4a35dee4eb72b6440382d4f85228f7a55fc20fa0a212d75a6d7aadb0"
    },
    {
      "path": "/usr/libexec/rp1-gpclk-dkms/gate-d-boot",
      "sha256": "731b122fbc154e4945397bf844bdb093865175f16b92376972fd72e352893bf3"
    },
    {
      "path": "/usr/libexec/rp1-gpclk-dkms/gate-d-bootstrap",
      "sha256": "a656e17673f1799e7d43d9f9992ff975a745e796f80d9035de33e02328276dfe"
    },
    {
      "path": "/usr/libexec/rp1-gpclk-dkms/gate-d-busy-injector",
      "sha256": "c01d97301fcbad4266e6fd41c040f561da0c106affc28cf353455e4a071331dd"
    },
    {
      "path": "/usr/libexec/rp1-gpclk-dkms/gate-d-executor",
      "sha256": "d81824ab0454ecb298714e07c08ff9d81255d216152631e5285e51e08ac1d43f"
    },
    {
      "path": "/usr/libexec/rp1-gpclk-dkms/gate-d-instance",
      "sha256": "dcf3bc81646d71bc6ab431077fda06b3c61d7b06750d7354436aee24cad8b907"
    },
    {
      "path": "/usr/libexec/rp1-gpclk-dkms/gate-d-lifecycle",
      "sha256": "1e6fbf956bb610f9d9cf27f35af99f9bc6244a87aa0e91c9d918b8f9a84b4205"
    },
    {
      "path": "/usr/libexec/rp1-gpclk-dkms/gate-d-platform",
      "sha256": "d749859b0c915c4cfde8df85aa088359f7ed87d77183ae927c82bc1f149afb3c"
    },
    {
      "path": "/usr/libexec/rp1-gpclk-dkms/gate-d-residue",
      "sha256": "64e8c6e0bfb3bf99961230e9489359f093d2c1ccfcab630f28919f3bc2be4f4f"
    },
    {
      "path": "/usr/libexec/rp1-gpclk-dkms/gate-d-target-plan",
      "sha256": "f8becd4ea0b33f3f7021e97e882630afcd6a343eb0be8cd8e57473a09099d756"
    },
    {
      "path": "/usr/libexec/rp1-gpclk-dkms/gate-d-uapi-probe",
      "sha256": "1ee335da403784a775efc049f49eb598e3541c625418b65015b322e29b0a1742"
    },
    {
      "path": "/usr/libexec/rp1-gpclk-dkms/gate_d_attempts.py",
      "sha256": "7496e08b4a35dee4eb72b6440382d4f85228f7a55fc20fa0a212d75a6d7aadb0"
    },
    {
      "path": "/usr/libexec/rp1-gpclk-dkms/gate_d_bootstrap.py",
      "sha256": "a656e17673f1799e7d43d9f9992ff975a745e796f80d9035de33e02328276dfe"
    },
    {
      "path": "/usr/libexec/rp1-gpclk-dkms/gate_d_instance.py",
      "sha256": "dcf3bc81646d71bc6ab431077fda06b3c61d7b06750d7354436aee24cad8b907"
    },
    {
      "path": "/usr/libexec/rp1-gpclk-dkms/gate_d_lifecycle.py",
      "sha256": "1e6fbf956bb610f9d9cf27f35af99f9bc6244a87aa0e91c9d918b8f9a84b4205"
    },
    {
      "path": "/usr/libexec/rp1-gpclk-dkms/gate_d_outer.py",
      "sha256": "d81824ab0454ecb298714e07c08ff9d81255d216152631e5285e51e08ac1d43f"
    },
    {
      "path": "/usr/libexec/rp1-gpclk-dkms/gate_d_preroot.py",
      "sha256": "4910e737830495b0fe6b8f41e3947b62968a2bcee32b0178288a37a3b525d7b8"
    },
    {
      "path": "/usr/libexec/rp1-gpclk-dkms/gate_d_root.py",
      "sha256": "d8227d99dda0fd8c3383e7b080b23d7407ff26520cc73a18ab3882d06ca4b94d"
    },
    {
      "path": "/usr/libexec/rp1-gpclk-dkms/gate_d_target_plan.py",
      "sha256": "f8becd4ea0b33f3f7021e97e882630afcd6a343eb0be8cd8e57473a09099d756"
    },
    {
      "path": "/usr/libexec/rp1-gpclk-dkms/lifecycle-policy",
      "sha256": "29075e6f15c04a5b1f7e2610b5dc23530228473f1285b7efdd999d319e53f6a7"
    },
    {
      "path": "/usr/libexec/rp1-gpclk-dkms/rp1-gpclk-admin",
      "sha256": "b99900c3c43c2eeeebdf89ec0f498014dcdc68769b2013749d4486890cfb831b"
    },
    {
      "path": "/usr/libexec/rp1-gpclk-dkms/rp1-gpclk-diagnostics",
      "sha256": "3db0bac2b18694f44e2c1dfbc2ab9fe28c621040213d7e98783a08a61ac93681"
    }
  ],
  "safety": {
    "clockEnabled": false,
    "dmaActive": false,
    "gpioAccess": false,
    "liveOutput": false,
    "outputDisabled": true,
    "rf": false,
    "sdrActive": false
  },
  "schemaVersion": 3,
  "stagingDirectory": "/var/lib/rp1-gpclk-dkms/gate-d/bootstrap-phase5.37"
}
